{
  "$schema": "https://json-schema.org/draft/2020-12/schema",
  "title": "pro-editor-kit SFX library manifest",
  "type": "object",
  "required": [
    "whoosh",
    "pop"
  ],
  "properties": {
    "whoosh": {
      "type": "array",
      "items": {
        "type": "object",
        "required": [
          "file"
        ],
        "properties": {
          "file": {
            "type": "string"
          },
          "peak": {
            "type": "number",
            "minimum": 0
          },
          "dur": {
            "type": "number",
            "minimum": 0
          },
          "tags": {
            "type": "array",
            "items": {
              "type": "string"
            }
          }
        }
      }
    },
    "pop": {
      "type": "array",
      "items": {
        "type": "object",
        "required": [
          "file"
        ],
        "properties": {
          "file": {
            "type": "string"
          },
          "peak": {
            "type": "number",
            "minimum": 0
          },
          "dur": {
            "type": "number",
            "minimum": 0
          },
          "tags": {
            "type": "array",
            "items": {
              "type": "string"
            }
          }
        }
      }
    },
    "click": {
      "type": "array",
      "items": {
        "type": "object",
        "required": [
          "file"
        ],
        "properties": {
          "file": {
            "type": "string"
          },
          "peak": {
            "type": "number",
            "minimum": 0
          },
          "dur": {
            "type": "number",
            "minimum": 0
          },
          "tags": {
            "type": "array",
            "items": {
              "type": "string"
            }
          }
        }
      }
    },
    "ui_click": {
      "type": "array",
      "items": {
        "type": "object",
        "required": [
          "file"
        ],
        "properties": {
          "file": {
            "type": "string"
          },
          "peak": {
            "type": "number",
            "minimum": 0
          },
          "dur": {
            "type": "number",
            "minimum": 0
          },
          "tags": {
            "type": "array",
            "items": {
              "type": "string"
            }
          }
        }
      }
    },
    "ui_success": {
      "type": "array",
      "items": {
        "type": "object",
        "required": [
          "file"
        ],
        "properties": {
          "file": {
            "type": "string"
          },
          "peak": {
            "type": "number",
            "minimum": 0
          },
          "dur": {
            "type": "number",
            "minimum": 0
          },
          "tags": {
            "type": "array",
            "items": {
              "type": "string"
            }
          }
        }
      }
    },
    "ui_fail": {
      "type": "array",
      "items": {
        "type": "object",
        "required": [
          "file"
        ],
        "properties": {
          "file": {
            "type": "string"
          },
          "peak": {
            "type": "number",
            "minimum": 0
          },
          "dur": {
            "type": "number",
            "minimum": 0
          },
          "tags": {
            "type": "array",
            "items": {
              "type": "string"
            }
          }
        }
      }
    },
    "scifi": {
      "type": "array",
      "items": {
        "type": "object",
        "required": [
          "file"
        ],
        "properties": {
          "file": {
            "type": "string"
          },
          "peak": {
            "type": "number",
            "minimum": 0
          },
          "dur": {
            "type": "number",
            "minimum": 0
          },
          "tags": {
            "type": "array",
            "items": {
              "type": "string"
            }
          }
        }
      }
    },
    "riser": {
      "type": "array",
      "items": {
        "type": "object",
        "required": [
          "file"
        ],
        "properties": {
          "file": {
            "type": "string"
          },
          "peak": {
            "type": "number",
            "minimum": 0
          },
          "dur": {
            "type": "number",
            "minimum": 0
          },
          "tags": {
            "type": "array",
            "items": {
              "type": "string"
            }
          }
        }
      }
    },
    "hit": {
      "type": "array",
      "items": {
        "type": "object",
        "required": [
          "file"
        ],
        "properties": {
          "file": {
            "type": "string"
          },
          "peak": {
            "type": "number",
            "minimum": 0
          },
          "dur": {
            "type": "number",
            "minimum": 0
          },
          "tags": {
            "type": "array",
            "items": {
              "type": "string"
            }
          }
        }
      }
    }
  }
}